{
  "schema_version": 1,
  "name": "三线夺旗场",
  "briefing": "你（绿色方）控制三名士兵，配备冲锋枪、步枪和火箭筒，出生在场地左上方。目标是占领中央旗点并坚守30秒。红方守左路入口，蓝方可从右侧绕后。利用沙包和木箱掩护推进，注意侧翼偷袭。火箭筒可摧毁敌方掩体或压制集群。保持移动，避免被交叉火力锁定。",
  "tactical_plan": [
    "正面压制+侧翼包抄：绿色方以步枪和冲锋枪从中路推进，利用旗点两侧沙包作为掩体，吸引红蓝火力；同时派火箭筒兵从左侧绕后，利用木箱掩护，打击红方侧翼或蓝方后方。此打法依赖中路牵制，若侧翼被反制则易陷入包围。",
    "快速夺旗+防守反击：绿色方全体从右侧快速接近旗点，利用木箱和沙包建立临时防线，火箭筒兵负责清除旗点附近的掩体。蓝方可能从右侧绕后，红方从正面冲击，绿色方需在夺旗后迅速分散至两翼掩体，形成交叉火力。此打法风险在于初期暴露，若被红蓝夹击则难以立足。"
  ],
  "base_map": 0,
  "objective": [
    0.54,
    2.17
  ],
  "hold_seconds": 30,
  "spawns": [
    [
      -0.05,
      3.25
    ],
    [
      1.02,
      1.78
    ],
    [
      0.1,
      1.35
    ]
  ],
  "loadouts": {
    "green": [
      "smg",
      "rifle",
      "rocket"
    ],
    "blue": [
      "rifle",
      "smg",
      "rocket"
    ],
    "red": [
      "rifle",
      "smg",
      "rocket"
    ]
  },
  "covers": [
    {
      "kind": "sandbag",
      "position": [
        0.35,
        2.0
      ],
      "size": [
        0.12,
        0.06,
        0.08
      ],
      "yaw": 0
    },
    {
      "kind": "sandbag",
      "position": [
        0.73,
        2.0
      ],
      "size": [
        0.12,
        0.06,
        0.08
      ],
      "yaw": 0
    },
    {
      "kind": "crate",
      "position": [
        0.2,
        2.5
      ],
      "size": [
        0.1,
        0.05,
        0.1
      ],
      "yaw": 0
    },
    {
      "kind": "crate",
      "position": [
        0.88,
        2.5
      ],
      "size": [
        0.1,
        0.05,
        0.1
      ],
      "yaw": 0
    },
    {
      "kind": "sandbag",
      "position": [
        0.54,
        1.8
      ],
      "size": [
        0.15,
        0.06,
        0.08
      ],
      "yaw": 90
    },
    {
      "kind": "sandbag",
      "position": [
        0.54,
        2.54
      ],
      "size": [
        0.15,
        0.06,
        0.08
      ],
      "yaw": 90
    },
    {
      "kind": "crate",
      "position": [
        0.1,
        2.9
      ],
      "size": [
        0.1,
        0.05,
        0.1
      ],
      "yaw": 0
    },
    {
      "kind": "crate",
      "position": [
        0.98,
        1.5
      ],
      "size": [
        0.1,
        0.05,
        0.1
      ],
      "yaw": 0
    }
  ]
}
