{
  "schema_version": 1,
  "name": "交叉火力与侧路夺旗",
  "briefing": "绿色沿沙包交替推进，蓝方利用侧路，红方守住旗点入口。",
  "tactical_plan": [
    "中央旗区留出多向接近通道",
    "两翼掩体支撑交替推进，避免全员冲锋",
    "每队保留火箭兵应对红方装甲"
  ],
  "base_map": 0,
  "objective": [
    0.54,
    2.17
  ],
  "hold_seconds": 30,
  "spawns": [
    [
      -0.05,
      3.25
    ],
    [
      1.02,
      1.78
    ],
    [
      0.1,
      1.35
    ]
  ],
  "loadouts": {
    "green": [
      "rifle",
      "smg",
      "rocket"
    ],
    "blue": [
      "rifle",
      "smg",
      "rocket"
    ],
    "red": [
      "rifle",
      "smg",
      "rocket"
    ]
  },
  "covers": [
    {
      "kind": "sandbag",
      "position": [
        0.13,
        1.68
      ],
      "size": [
        0.34,
        0.06,
        0.043
      ],
      "yaw": 0
    },
    {
      "kind": "sandbag",
      "position": [
        0.55,
        1.91
      ],
      "size": [
        0.25,
        0.06,
        0.043
      ],
      "yaw": 0
    },
    {
      "kind": "sandbag",
      "position": [
        0.06,
        2.3
      ],
      "size": [
        0.3,
        0.06,
        0.043
      ],
      "yaw": 90
    },
    {
      "kind": "sandbag",
      "position": [
        1.01,
        2.31
      ],
      "size": [
        0.3,
        0.06,
        0.043
      ],
      "yaw": 90
    },
    {
      "kind": "sandbag",
      "position": [
        0.59,
        2.57
      ],
      "size": [
        0.27,
        0.06,
        0.043
      ],
      "yaw": 0
    },
    {
      "kind": "sandbag",
      "position": [
        0.12,
        2.91
      ],
      "size": [
        0.3,
        0.06,
        0.043
      ],
      "yaw": 0
    },
    {
      "kind": "sandbag",
      "position": [
        0.99,
        2.88
      ],
      "size": [
        0.28,
        0.06,
        0.043
      ],
      "yaw": 0
    },
    {
      "kind": "crate",
      "position": [
        0.32,
        2.35
      ],
      "size": [
        0.09,
        0.042,
        0.06
      ],
      "yaw": 0
    },
    {
      "kind": "crate",
      "position": [
        0.78,
        1.99
      ],
      "size": [
        0.08,
        0.04,
        0.065
      ],
      "yaw": 0
    },
    {
      "kind": "crate",
      "position": [
        0.9,
        2.72
      ],
      "size": [
        0.085,
        0.045,
        0.07
      ],
      "yaw": 0
    }
  ]
}